{
  "schema_version": "interpretation-integrity.fixture-annotation-packet.v0",
  "packet_id": "fixture-annotation-packet-v0",
  "corpus_hash": "sha256:82ffd93e9386732762c729cf680b3251ff1b98e084540df8ddd3477164fa834f",
  "case_schema_hash": "sha256:acd48279de802c10442c0a763e3fd27c74f476cc8882c19d2f088f240ea28a60",
  "rubric_hash": "sha256:6b2e48a899531d950e792cc6cd85b5f1d040ea0ad93898a1866330f4a53308dd",
  "release_order": [
    "stage_a",
    "stage_b",
    "stage_c"
  ],
  "stage_a": {
    "release_condition": "initial",
    "cases": [
      {
        "case_id": "ii-actor-attribution-1",
        "conversation": [
          {
            "actor": "speaker",
            "role": "user",
            "text": "Mira said, ‘The launch is premature.’ I think the schedule is fine.",
            "turn_id": "turn-1"
          }
        ],
        "target_turn_id": "turn-1",
        "units": [
          {
            "unit_id": "unit-1",
            "source_locator": {
              "end": 37,
              "start": 0,
              "text": "Mira said, ‘The launch is premature.’",
              "turn_id": "turn-1"
            }
          },
          {
            "unit_id": "unit-2",
            "source_locator": {
              "end": 67,
              "start": 38,
              "text": "I think the schedule is fine.",
              "turn_id": "turn-1"
            }
          }
        ]
      },
      {
        "case_id": "ii-actor-attribution-2",
        "conversation": [
          {
            "actor": "speaker",
            "role": "user",
            "text": "The reviewer doubts the estimate; I only forwarded the note.",
            "turn_id": "turn-1"
          }
        ],
        "target_turn_id": "turn-1",
        "units": [
          {
            "unit_id": "unit-1",
            "source_locator": {
              "end": 32,
              "start": 0,
              "text": "The reviewer doubts the estimate",
              "turn_id": "turn-1"
            }
          },
          {
            "unit_id": "unit-2",
            "source_locator": {
              "end": 60,
              "start": 34,
              "text": "I only forwarded the note.",
              "turn_id": "turn-1"
            }
          }
        ]
      },
      {
        "case_id": "ii-quotation-1",
        "conversation": [
          {
            "actor": "speaker",
            "role": "user",
            "text": "A headline says ‘the system never fails.’ Can you critique that claim?",
            "turn_id": "turn-1"
          }
        ],
        "target_turn_id": "turn-1",
        "units": [
          {
            "unit_id": "unit-1",
            "source_locator": {
              "end": 41,
              "start": 0,
              "text": "A headline says ‘the system never fails.’",
              "turn_id": "turn-1"
            }
          },
          {
            "unit_id": "unit-2",
            "source_locator": {
              "end": 70,
              "start": 42,
              "text": "Can you critique that claim?",
              "turn_id": "turn-1"
            }
          }
        ]
      },
      {
        "case_id": "ii-quotation-2",
        "conversation": [
          {
            "actor": "speaker",
            "role": "user",
            "text": "Use the sentence ‘we guarantee delivery’ as an example of risky copy.",
            "turn_id": "turn-1"
          }
        ],
        "target_turn_id": "turn-1",
        "units": [
          {
            "unit_id": "unit-1",
            "source_locator": {
              "end": 40,
              "start": 17,
              "text": "‘we guarantee delivery’",
              "turn_id": "turn-1"
            }
          },
          {
            "unit_id": "unit-2",
            "source_locator": {
              "turn_id": "turn-1",
              "start": 0,
              "end": 69,
              "text": "Use the sentence ‘we guarantee delivery’ as an example of risky copy."
            }
          }
        ]
      },
      {
        "case_id": "ii-joke-hyperbole-1",
        "conversation": [
          {
            "actor": "speaker",
            "role": "user",
            "text": "Sure, one more meeting and I will become pure calendar.",
            "turn_id": "turn-1"
          }
        ],
        "target_turn_id": "turn-1",
        "units": [
          {
            "unit_id": "unit-1",
            "source_locator": {
              "end": 55,
              "start": 0,
              "text": "Sure, one more meeting and I will become pure calendar.",
              "turn_id": "turn-1"
            }
          }
        ]
      },
      {
        "case_id": "ii-joke-hyperbole-2",
        "conversation": [
          {
            "actor": "speaker",
            "role": "user",
            "text": "At this rate the printer is our most senior engineer.",
            "turn_id": "turn-1"
          }
        ],
        "target_turn_id": "turn-1",
        "units": [
          {
            "unit_id": "unit-1",
            "source_locator": {
              "end": 53,
              "start": 0,
              "text": "At this rate the printer is our most senior engineer.",
              "turn_id": "turn-1"
            }
          }
        ]
      },
      {
        "case_id": "ii-counterfactual-1",
        "conversation": [
          {
            "actor": "speaker",
            "role": "user",
            "text": "If the vendor disappeared tomorrow, what would our fallback be?",
            "turn_id": "turn-1"
          }
        ],
        "target_turn_id": "turn-1",
        "units": [
          {
            "unit_id": "unit-1",
            "source_locator": {
              "end": 63,
              "start": 0,
              "text": "If the vendor disappeared tomorrow, what would our fallback be?",
              "turn_id": "turn-1"
            }
          }
        ]
      },
      {
        "case_id": "ii-counterfactual-2",
        "conversation": [
          {
            "actor": "speaker",
            "role": "user",
            "text": "Suppose the budget doubled—would the constraint move to staffing?",
            "turn_id": "turn-1"
          }
        ],
        "target_turn_id": "turn-1",
        "units": [
          {
            "unit_id": "unit-1",
            "source_locator": {
              "end": 65,
              "start": 0,
              "text": "Suppose the budget doubled—would the constraint move to staffing?",
              "turn_id": "turn-1"
            }
          }
        ]
      },
      {
        "case_id": "ii-correction-rejection-1",
        "conversation": [
          {
            "actor": "speaker",
            "role": "user",
            "text": "No, I did not approve the release; I asked for a preview.",
            "turn_id": "turn-1"
          }
        ],
        "target_turn_id": "turn-1",
        "units": [
          {
            "unit_id": "unit-1",
            "source_locator": {
              "end": 33,
              "start": 4,
              "text": "I did not approve the release",
              "turn_id": "turn-1"
            }
          },
          {
            "unit_id": "unit-2",
            "source_locator": {
              "end": 57,
              "start": 35,
              "text": "I asked for a preview.",
              "turn_id": "turn-1"
            }
          }
        ]
      },
      {
        "case_id": "ii-correction-rejection-2",
        "conversation": [
          {
            "actor": "speaker",
            "role": "user",
            "text": "I am not proposing a merger. I am asking whether the teams should share tooling.",
            "turn_id": "turn-1"
          }
        ],
        "target_turn_id": "turn-1",
        "units": [
          {
            "unit_id": "unit-1",
            "source_locator": {
              "end": 28,
              "start": 0,
              "text": "I am not proposing a merger.",
              "turn_id": "turn-1"
            }
          },
          {
            "unit_id": "unit-2",
            "source_locator": {
              "end": 80,
              "start": 29,
              "text": "I am asking whether the teams should share tooling.",
              "turn_id": "turn-1"
            }
          }
        ]
      },
      {
        "case_id": "ii-qualification-1",
        "conversation": [
          {
            "actor": "speaker",
            "role": "user",
            "text": "The approach probably works for small teams, but I have not tested larger ones.",
            "turn_id": "turn-1"
          }
        ],
        "target_turn_id": "turn-1",
        "units": [
          {
            "unit_id": "unit-1",
            "source_locator": {
              "end": 79,
              "start": 0,
              "text": "The approach probably works for small teams, but I have not tested larger ones.",
              "turn_id": "turn-1"
            }
          }
        ]
      },
      {
        "case_id": "ii-qualification-2",
        "conversation": [
          {
            "actor": "speaker",
            "role": "user",
            "text": "I lean toward option B, assuming the legal review stays green.",
            "turn_id": "turn-1"
          }
        ],
        "target_turn_id": "turn-1",
        "units": [
          {
            "unit_id": "unit-1",
            "source_locator": {
              "end": 62,
              "start": 0,
              "text": "I lean toward option B, assuming the legal review stays green.",
              "turn_id": "turn-1"
            }
          }
        ]
      },
      {
        "case_id": "ii-evidence-status-1",
        "conversation": [
          {
            "actor": "speaker",
            "role": "user",
            "text": "Three customers mentioned latency; that is a signal, not proof of the cause.",
            "turn_id": "turn-1"
          }
        ],
        "target_turn_id": "turn-1",
        "units": [
          {